ID,Title,Company,Location,Type,Category,Skills,Description,Created At
69c43ee341e401fbb886f269,"Data Entry","J&T Cargo Indonesia (PT Global Yimi Cargo)","Denpasar, Bali","Penuh Waktu","Data","Database Management; Data Entry; +4; Kerja di kantor; Pengalaman kurang dari 1 tahun; Minimal SMA/SMK; Perempuan saja; Administration","Deskripsi pekerjaan Data Entry J&T Cargo Indonesia (PT Global Yimi Cargo) Kami membuka kesempatan bagi profesional yang teliti, komunikatif, dan bertanggung jawab untuk bergabung sebagai Admin Network (Mitra) di J&T Cargo. Posisi ini berperan penting dalam pengelolaan data, administrasi, serta koordinasi dengan mitra/agen guna memastikan operasional jaringan berjalan efektif, tertib, dan sesuai standar perusahaan. Tanggung Jawab: Melakukan pendataan dan pengelolaan administrasi mitra/agen (registrasi, update data, kelengkapan dokumen). Memastikan kelengkapan dokumen kerja sama mitra sesuai SOP perusahaan. Melakukan monitoring performa mitra (volume kiriman, SLA, komplain, dll). Berkoordinasi dengan tim operasional terkait kendala jaringan atau performa mitra. Membantu proses evaluasi dan perpanjangan kerja sama mitra. Menindaklanjuti laporan kendala dari mitra dan melakukan follow up hingga selesai. Membuat laporan harian, mingguan, dan bulanan terkait data mitra dan performa jaringan. Mengarsipkan dokumen kerja sama dan administrasi mitra secara rapi dan sistematis. Membantu proses pembukaan titik mitra baru (jika diperlukan). Kualifikasi: Usia 22 – 29 tahun. Pendidikan minimal D3/S1 semua jurusan (diutamakan Manajemen, Administrasi, atau sejenisnya). Pengalaman minimal 1–2 tahun sebagai Admin Network/Admin Operasional (diutamakan di perusahaan logistik atau ekspedisi). Teliti, detail-oriented, dan memiliki kemampuan analisa data yang baik. Mampu berkomunikasi dengan baik serta menjalin hubungan profesional dengan mitra. Mampu bekerja di bawah tekanan dan deadline. Menguasai Microsoft Office (terutama Excel). Mampu bekerja dalam tim dan menjaga kerahasiaan data perusahaan. Bersedia melakukan monitoring atau follow up kasus urgent di luar jam kerja (jika diperlukan).",Thu Mar 26 2026 03:00:35 GMT+0700 (Western Indonesia Time)
69c43ee341e401fbb886f26a,"Data Analyst","PT. Adimahaka Garuda Indomakmur","Yogyakarta, DI Yogyakarta","Penuh Waktu","Data","Tableau; +8; Kerja di kantor; 1 - 3 tahun pengalaman; Minimal Sarjana (S1); 23-35 tahun; Data Analysis; Data Visualization","Deskripsi pekerjaan Data Analyst PT. Adimahaka Garuda Indomakmur Kualifikasi : Pendidikan minimal S1 di bidang Statistik, Matematika, Ekonomi, Teknik Informatika, Sistem Informasi, atau jurusan terkait. Pengalaman minimal 1 tahun
Menguasai SQL untuk query database
Mahir menggunakan Excel (pivot table, lookup, formula lanjutan). Menguasai tools visualisasi data: Tableau, Power BI, atau Google Data Studio
Familiar dengan Python untuk analisis data. Kemampuan berpikir analitis & problem solving. Teliti, detail-oriented, dan mampu bekerja dengan data besar. Kemampuan komunikasi yang baik untuk menyampaikan insight ke tim non-teknis. Kolaborasi dengan tim lintas divisi (finance, marketing, product, dll). Jobdesk : Mengumpulkan, mengolah, dan membersihkan data
Menganalisis data untuk menemukan pola dan insight
Membuat laporan dan dashboard data
Menyajikan hasil analisis untuk mendukung pengambilan keputusan
Berkolaborasi dengan tim terkait untuk kebutuhan data",Thu Mar 26 2026 03:00:35 GMT+0700 (Western Indonesia Time)
69c43ee341e401fbb886f26b,"Data Analis","PT Markaz Jalan Bersama","Tangerang Selatan, Banten","Penuh Waktu","Data","Microsoft Excel; Statistics; +1; Kerja di kantor; Pengalaman kurang dari 1 tahun; Minimal Sarjana (S1); 20-22 tahun; Data Analysis","Deskripsi pekerjaan Data Analis PT Markaz Jalan Bersama Kualifikasi : Usia maksimal 23 tahun. Pendidikan minimal S1 Matematika danStatistika
Teliti, detail-oriented, kritis, dan memiliki kemampuan problem solving yang baik. Memiliki kemampuan analisis, mengolah data, menarik insight, serta menyajikan data secara jelas dan ringkas. Peka terhadap tren pasar dan perkembangan bisnis. Memiliki kemampuan komunikasi yang baik serta mampu berkoordinasi dengan tim terkait. Jobdesk : Mengolah dan menganalisis data transaksi member serta performa produk secara berkala. Mengidentifikasi tren dan penyebab perubahan laba, termasuk faktor naik turunnya penjualan dan member aktif. Mengevaluasi performa produk dan member untuk mengetahui perkembangan serta potensi risiko (penurunan/churn). Menyusun dan menyajikan laporan analisis dalam bentuk data, grafik, dan insight yang mudah dipahami untuk tim provider/manajemen.",Thu Mar 26 2026 03:00:35 GMT+0700 (Western Indonesia Time)
69c43ee341e401fbb886f26c,"Data Entry","The Parentinc","Jakarta Selatan, DKI Jakarta","Penuh Waktu","Data","+10; Hybrid
1 - 3 tahun pengalaman
Minimal SMA/SMK
18-39 tahun; Hybrid; 1 - 3 tahun pengalaman; Minimal SMA/SMK; 18-39 tahun; Data Collection; Database Management","Deskripsi pekerjaan Data Entry The Parentinc Job Description: Input and update data accurately into spreadsheets, databases, or company systems while ensuring consistency and attention to detail
Verify, review, and correct information to maintain data quality and integrity
Organize and manage files or reports to support administrative and operational tasks efficiently Requirements: Bachelor’s degree (S1) from any major is preferred
Willing to work from office (WFO) 2 days per week in Jakarta
Basic experience in data entry is required
Proficiency in Microsoft Excel or Google Sheets is preferred",Thu Mar 26 2026 03:00:35 GMT+0700 (Western Indonesia Time)
69c43ee341e401fbb886f26d,"Data Scientist","PT. Barrans Global Mandiri","Jakarta Pusat, DKI Jakarta","Penuh Waktu","Data","R Language; +2; Kerja di kantor
3 - 5 tahun pengalaman
Minimal Sarjana (S1); Kerja di kantor; 3 - 5 tahun pengalaman; Minimal Sarjana (S1); Python; SQL","Deskripsi pekerjaan Data Scientist PT. Barrans Global Mandiri Data Scientist is responsible for transforming large volumes of raw data into actionable insights that drive strategic business decisions. This role focuses on building data infrastructure, conducting advanced statistical research, and creating visual representations of complex data sets to support the organization’s objectives. Responsibilities Establish and maintain robust data infrastructure to support analytical workflows. Gather and integrate data from various internal and external sources for comprehensive analysis. Conduct in-depth research and analysis on large-scale company datasets to identify patterns and trends. Utilize advanced programming languages to perform complex data modeling and statistical analysis. Transform analytical results into clear, visual formats such as graphs and dashboards to aid stakeholder understanding. Provide data-driven recommendations to meet business needs and support executive decision-making processes. Ensure all data handling and research activities comply with BPUI policies and procedures. Requirements Minimum 3 years of professional experience in a Data Scientist role. Strong expertise in mathematics, statistics, and data science methodologies. Advanced proficiency in programming languages, specifically R and Python. Mastery of SQL for database querying and data manipulation. Expert knowledge of Microsoft Power BI for data visualization and reporting. Proven ability to translate complex data findings into actionable business insights. Strong analytical, research, and problem-solving capabilities. Willingness to work On-Site (WFO).",Thu Mar 26 2026 03:00:35 GMT+0700 (Western Indonesia Time)
69c43ee341e401fbb886f26e,"Data Entry","Bakso Rusuk Samanhudi","Jakarta Pusat, DKI Jakarta","Penuh Waktu","Data","Microsoft Excel; +2; Kerja di kantor; 1 - 3 tahun pengalaman; Minimal SMA/SMK; 20-27 tahun; Data Entry; Accurate","Deskripsi pekerjaan Data Entry Bakso Rusuk Samanhudi Persyaratan Pendidikan SMA/Diploma ( Jurusan akutansi lebih di utamakan )
Pengalaman Minimal 2 tahun sebagai data entry / admin ( pengalaman admin restoran lebih di sukai )
Mahir menggunakan microsoft Excel ( Wajib )
Bisa menggunakan software akutansi accurate
Jujur, teliti dan rapi
Penempatan Jakarta Pusat Jobdecs Menginput Penjualan harian
Mengecek resi dan invoice
Membuat laporan sales harian/mingguan/bulanan
Membuat laporan stok barang
Melakukan pembayaran pembelian barang
Pekerjaan administrasi lain nya",Thu Mar 26 2026 03:00:35 GMT+0700 (Western Indonesia Time)
69c43ee341e401fbb886f26f,"Data Analyst","HIGO","Jakarta Barat, DKI Jakarta","Penuh Waktu","Data","Statistics; +7; Kerja di kantor
1 - 3 tahun pengalaman
Minimal Sarjana (S1); Kerja di kantor; 1 - 3 tahun pengalaman; Minimal Sarjana (S1); Power BI; Microsoft Excel","Deskripsi pekerjaan Data Analyst HIGO Requirement: 1. Bachelor’s degree in Data Science, Computer Science, Statistics, Mathematics, or related field with certifications related to data science, data analysts business analytics, or AI/ML. 2. 1–3 years of hands-on experience in a data analyst or similar analytical role. 3. Have a strong analytical mindset, excellent data manipulation skills, and a passion for uncovering insights that drive business value 4. Proficiency in MongoDB, SQL and programming languages like Python or R. 5. Strong experience with data visualization tools (e.g., Tableau, Power BI, or Looker). 6. Solid understanding of statistical analysis, hypothesis testing, and data modeling. 7. Familiarity with machine learning concepts and basic experience with frameworks like scikit-learn, TensorFlow, or similar. 8. Strong business acumen, data product knowledge and problem solving abilities. 9. Ability to clearly communicate technical insights to non-technical stakeholders. 10. Experience in a business analyst role or working closely with business units. 11. Knowledge of data engineering pipelines and tools is a plus. 12. Familiarity with AI use cases in business contexts (e.g., customer segmentation, churn prediction). Job Description: 1. Collect, clean, and transform data from multiple sources for analysis. Perform exploratory data analysis to identify trends, anomalies, and opportunities. Develop and maintain dashboards and reports to support data-driven decision-making. 4. Collaborate with product, marketing, operations, and other departments to understand data needs. Work with machine learning and AI teams to support data preparation and model evaluation. Assist in forecasting, segmentation, and performance analysis projects. Translate analytical findings into actionable business insights and recommendations. Document processes and develop reusable code/templates for analysis. Often collaborate with stakeholders to translate data into strategic decisions.",Thu Mar 26 2026 03:00:35 GMT+0700 (Western Indonesia Time)
69c43ee341e401fbb886f270,"Data Analyst","Nusantara Sakti Group","Jakarta Barat, DKI Jakarta","Penuh Waktu","Data","Business Strategy; +11; Kerja di kantor; 1 - 3 tahun pengalaman; Minimal Sarjana (S1); 21-30 tahun; Pivot Table; Business Growth Strategy","Deskripsi pekerjaan Data Analyst Nusantara Sakti Group Qualifications: Pendidikan minimal S1 jurusan Statistika, Matematika, Accounting, Aktuaria, Ekonomi, Sistem Informasi, dan jurusan relevan lainnya
Menguasai Excel minimal intermediate , kemampuan SQL / Power BI / Tableu menjadi nilai tambah
Mampu menganalisa data dalam jumlah besar dan membuat forecasting
Komunikatif dan Detail-oriented
Inisiatif dan mampu bekerja lintas tim/divisi
Memiliki ketertarikan dan pemahaman tentang dunia bisnis
Memahami Business Process Management menjadi nilai tambah
Memiliki pengalaman sebagai Data analyst menjadi nilai tambah
Penempatan Jakarta Barat Jobdesc: Melakukan analisa data pencapaian dan alur proses dari sebuah bisnis
Bertanggung jawab terhadap pencapaian bisnis
Mampu mengolah, menganalisa, mengintepretasi, dan memvisualisasi data sesuai bisnis/divisi yang menjadi tanggung jawab
Memberikan insight strategis dan actionable untuk meningkatkan efisiensi dan efektivitas
Menerjemahkan konsep improvement bisnis menjadi kebutuhan sistem (system requirement)
Berkoordinasi dengan tim IT untuk memastikan pemahaman kebutuhan sistem sesuai dengan konsep bisnis
Melakukan analisa ulang apabila hasil penerapan belum sesuai ekspektasi, sehingga terbentuk pola continuous development / continuous improvement agar sistem dan proses terus berkembang secara berkelanjutan. Membangun hubungan kerjasama internal dan eksternal
Mempersiapkan laporan bulanan, triwulan, dan tahunan",Thu Mar 26 2026 03:00:35 GMT+0700 (Western Indonesia Time)
69c43ee341e401fbb886f271,"Data Scientist","PT Evolusi Teknologi Solusi (Evoteks)","Jakarta Pusat, DKI Jakarta","Penuh Waktu","Data","Machine Learning; +2; Kerja di kantor
3 - 5 tahun pengalaman
Minimal Sarjana (S1); Kerja di kantor; 3 - 5 tahun pengalaman; Minimal Sarjana (S1); Data Modeling; Python","Deskripsi pekerjaan Data Scientist PT Evolusi Teknologi Solusi (Evoteks) Requirements: - Min. S1 - Pengalaman dalam data science dan machine learning minimal 2 tahun. - Menguasai Python/R, TensorFlow/PyTorch, dan SQL. - Memiliki pemahaman tentang statistik, NLP, dan model prediktif. - Kemampuan komunikasi yang baik untuk menyampaikan hasil analisis secara jelas. Job Desc: - Mengembangkan model machine learning dan analisis prediktif berdasarkan data bisnis. - Membersihkan, memproses, dan mengeksplorasi data dari berbagai sumber. - Menggunakan teknik AI/ML untuk menemukan pola dan peluang bisnis. - Mengimplementasikan algoritma untuk otomatisasi proses dan optimasi sistem. - Berkolaborasi dengan tim produk dan teknologi untuk meningkatkan performa sistem berbasis data.",Thu Mar 26 2026 03:00:35 GMT+0700 (Western Indonesia Time)
69c43ee341e401fbb886f272,"Data Scientist","Perusahaan Premium","Jakarta Pusat, DKI Jakarta","Penuh Waktu","Data","+5; Hybrid; 1 - 3 tahun pengalaman; Minimal Sarjana (S1); 23-29 tahun; Machine Learning; Microsoft SQL Server; Python","Deskripsi pekerjaan Data Scientist Id/x Partners Description id/x partners is looking for talented and creative Data Scientists to work on cutting edge machine learning models. Ideal candidate should be highly skilled in all aspects of data analytics, including processing, mining, model generation, and visualization. The candidate must possess excellent written and verbal communication skills with the ability and knowhow to collaborate effectively with domain experts and IT leadership team. Ultimately, we’re after someone who is flexible, fast learner, result-focused, innovative and enjoying data. id/x partners is a private high growth organization headquartered in Jakarta and is a leading consulting firm for Data, Analytics & Decisioning solution in Asia-Pacific region. Our next-generation digital-enabler consultancy is the ideal place for you to grow your career. Are you up for the challenge? Read on! Responsibilities Well versed with Data Science and Machine learning based solutions and frameworks
Work on a large dataset on financial services domain, do number crunching, need to see through the data and analyze it to find conclusion. Gather, manage, and scrub data collected from various data platforms to be used as training and test data to develop the ML System. Ability to interpret the logical side of the data, demonstrate expertise in advanced analytics, and support analytics project implementation. Collaborate with Data Engineer and other Business Unit Leads to determine the system technical and functional specification. Researching & Development on how to improve models by using a vast amount of unique data. Requirements Preferably a Bachelor's Degree in mathematics, computer science, statistics, engineering, or a related major
Passionate about Machine Learning and an expert with Auto ML, ML Ops, and data science on ML platform. Good at applying statistics skills, such as distributions, statistical testing, regression, etc. Data-oriented personality and has a passion in big data. Solid analytical and problem-solving skills to create data-driven insights. Excellent communication skills, both verbal and written. Exceptional at collaborating with both technical and business people. Highly organized with a strong eye for detail",Thu Mar 26 2026 03:00:35 GMT+0700 (Western Indonesia Time)
69c43ee341e401fbb886f273,"Data Modeler","Proxima Konsultan Indonesia","Jakarta Pusat, DKI Jakarta","Penuh Waktu","Data","Data Architecture; +2; Kerja di kantor
5 - 10 tahun pengalaman
Minimal Sarjana (S1); Kerja di kantor; 5 - 10 tahun pengalaman; Minimal Sarjana (S1); Data Modeling; Powerdesigner","Deskripsi pekerjaan Data Modeler Proxima Konsultan Indonesia Work Location: Onsite – JAKARTA Client: Telco company Project Start: ASAP Role Overview We are seeking a skilled Data Modeler to design and implement scalable data models that support enterprise data and analytics initiatives. This role will collaborate closely with data architects, analysts, and business stakeholders to translate business requirements into robust logical and physical data models. Key Responsibilities Develop and maintain complex data models for reporting, analytics, and business intelligence. Collaborate with cross-functional stakeholders to gather and translate business data requirements into conceptual, logical, and physical models. Design and implement efficient database structures aligned with business and system needs. Create and maintain data dictionaries, metadata repositories, and documentation standards. Evaluate and recommend data modeling tools and technologies to improve modeling efficiency and governance. Identify and resolve data model performance issues, including query optimization. Document and communicate data modeling standards and best practices across teams. Stay current with industry trends and incorporate modern modeling methodologies. Required Skills & Experience Strong understanding of SQL and core data modeling principles. Proficiency in data modeling tools such as PowerDesigner or equivalent. Experience designing and implementing database schemas and structures. Ability to develop conceptual, logical, and physical data models. Familiarity with data warehousing concepts and ETL processes. Experience with database performance tuning and query optimization. Strong analytical, problem-solving, and documentation skills. Excellent communication skills and ability to engage effectively with both technical and non-technical stakeholders. Self-starter with the ability to work independently and collaboratively.",Thu Mar 26 2026 03:00:35 GMT+0700 (Western Indonesia Time)
69c43ee341e401fbb886f274,"Presales Data","PT. Quad Sinergi Teknologi","Jakarta Barat, DKI Jakarta","Penuh Waktu","Sales","Software Documentation; +6","Presales Data di PT. Quad Sinergi Teknologi. Bertanggung jawab dalam posisi ini di Jakarta Barat, DKI Jakarta. Skill yang diutamakan: Software Documentation, +6.",Thu Mar 26 2026 03:00:35 GMT+0700 (Western Indonesia Time)
69c43ee341e401fbb886f275,"Data Analis","Mecloth","Kab. Madiun, Jawa Timur","Penuh Waktu","Data","Python; +2","Data Analis di Mecloth. Bertanggung jawab dalam posisi ini di Kab. Madiun, Jawa Timur. Skill yang diutamakan: Python, +2.",Thu Mar 26 2026 03:00:35 GMT+0700 (Western Indonesia Time)
69c43ee341e401fbb886f276,"Data Analyst","PT. Quad Sinergi Teknologi","Jakarta Barat, DKI Jakarta","Penuh Waktu","Data","Power BI; +9","Data Analyst di PT. Quad Sinergi Teknologi. Bertanggung jawab dalam posisi ini di Jakarta Barat, DKI Jakarta. Skill yang diutamakan: Power BI, +9.",Thu Mar 26 2026 03:00:35 GMT+0700 (Western Indonesia Time)
69c43ee341e401fbb886f277,"Data Analyst","PT Sigma Global Teknologi","Jakarta Selatan, DKI Jakarta","Penuh Waktu","Data","ETL; +3","Data Analyst di PT Sigma Global Teknologi. Bertanggung jawab dalam posisi ini di Jakarta Selatan, DKI Jakarta. Skill yang diutamakan: ETL, +3.",Thu Mar 26 2026 03:00:35 GMT+0700 (Western Indonesia Time)
69c43ee341e401fbb886f278,"Data Engineer","PT DIGITAL SEJAHTERA NUSANTARA","Jakarta Selatan, DKI Jakarta","Penuh Waktu","Engineering","Python; +2","Data Engineer di PT DIGITAL SEJAHTERA NUSANTARA. Bertanggung jawab dalam posisi ini di Jakarta Selatan, DKI Jakarta. Skill yang diutamakan: Python, +2.",Thu Mar 26 2026 03:00:35 GMT+0700 (Western Indonesia Time)
69c43ee341e401fbb886f279,"Data Scientitst","PT Neural Technologies Indonesia (Official)","Jakarta Selatan, DKI Jakarta","Penuh Waktu","Engineering","SQL; +6","Data Scientitst di PT Neural Technologies Indonesia (Official). Bertanggung jawab dalam posisi ini di Jakarta Selatan, DKI Jakarta. Skill yang diutamakan: SQL, +6.",Thu Mar 26 2026 03:00:35 GMT+0700 (Western Indonesia Time)
69c43ee341e401fbb886f27a,"Data Scienstist","PT Neural Technologies Indonesia (Official)","Jakarta Selatan, DKI Jakarta","Penuh Waktu","Data","Tunning Process; +2","Data Scienstist di PT Neural Technologies Indonesia (Official). Bertanggung jawab dalam posisi ini di Jakarta Selatan, DKI Jakarta. Skill yang diutamakan: Tunning Process, +2.",Thu Mar 26 2026 03:00:35 GMT+0700 (Western Indonesia Time)
69c43ee341e401fbb886f27b,"Design","PT Rinus Marvent Indonesia","Tangerang, Banten","Penuh Waktu","Design","Graphic Design; +9; Kerja di kantor; 1 - 3 tahun pengalaman; Minimal SMA/SMK; 23-35 tahun; Laki-laki saja; Adobe Illustrator","Deskripsi pekerjaan Design PT Rinus Marvent Indonesia
Pembuatan Konten Visual: Merancang logo, brosur, materi pemasaran, konten media sosial, kemasan (packaging), dan materi presentasi. Pengembangan Konsep Kreatif: Menerjemahkan brief atau ide menjadi desain visual yang menarik, sesuai dengan brand identity dan target audiens. Proses Produksi & Revisi: Membuat draf desain, melakukan revisi berdasarkan feedback atasan/klien, serta meninjau kesalahan sebelum hasil akhir diproduksi. Kolaborasi Tim: Bekerja sama dengan tim marketing, atau divisi lain untuk memastikan kesesuaian pesan dan tujuan proyek. Manajemen Aset Digital: Mendokumentasikan dan mengarsipkan file desain dengan rapi agar mudah dicari. Riset Tren: Memperbarui keterampilan dan mengikuti tren desain terbaru agar hasil kerja tetap relevan
Manajemen Tenggat Waktu: Bertanggung jawab untuk menyelesaikan proyek desain tepat waktu sesuai dengan jadwal yang telah ditentukan oleh perusahaan / klien",Thu Mar 26 2026 03:00:35 GMT+0700 (Western Indonesia Time)
69c43ee341e401fbb886f27c,"Product Design","Kwala","Jakarta Selatan, DKI Jakarta","Penuh Waktu","Product","Production Planning And Material Control; +8; Kerja di kantor; 1 - 3 tahun pengalaman; Minimal Diploma (D1 - D4); Material Design; Adobe Illustrator; Sketch","Deskripsi pekerjaan Product Design Kwala At KWALA, we believe great sleep starts with thoughtfully crafted products. We are looking for a Product Design Specialist who is not only detail-oriented, but also has a strong instinct in identifying what the market truly needs and turning it into products people genuinely love. Job Description: Lead the development of new products from idea to launch
Translate market trends, customer behavior, and internal insights into relevant product concepts
Work closely with other team to ensure seamless execution
Manage product sampling, iteration, and quality control process
Contribute to product positioning, pricing logic, and overall storytelling
Evaluate product performance and continuously refine what we build next Qualification: 2–4 years of experience in product development, R&D, or merchandising (fashion, home living, bedding preferred)
Understands both product thinking and execution detail
Has strong taste level and sensitivity towards premium products
Is proactive, structured, and comfortable working in a fast-moving environment
Is ready to take ownership, but still enjoys being hands-on If you're excited to learn, contribute to meaningful collaborations, and grow with a fast-moving brand, we’d love to meet you!",Thu Mar 26 2026 03:00:35 GMT+0700 (Western Indonesia Time)
69c43ee341e401fbb886f27d,"Junior Interior Design","PT. Senada Nijdam Design","Jakarta Selatan, DKI Jakarta","Penuh Waktu","Design","SketchUp; Interior and Exterior Design; +7; Kerja di kantor; Pengalaman kurang dari 1 tahun; Minimal Sarjana (S1); 20-35 tahun; Adobe Illustrator","Deskripsi pekerjaan Junior Interior Design PT. Senada Nijdam Design We’re Hiring – Junior Interior Design PT. Senada Nijdam Design is seeking a Junior Interior Designer Staff who’s experienced, strategic, and passionate about the interior design industry. If you're ready to bring fresh ideas to life and shape extraordinary spaces, we want to hear from you! 📍 Location: Cilandak, South Jakarta. 📌 Position: Full-Time Requirements: Bachelor's degree in Interior Design or a related field Minimum 1 years of experience in interior design (fresh graduate with strong portfolios are welcome to apply) Strong design and visualization skills (AutoCAD, SkethUp, 3Ds Max, or similar) Excellent attention to detail, time management, and communication skills Passionate, proactive, and solution-oriented Key Responsibilities: Create innovative, functional, and aesthetic interior design concepts Develop detailed layout plans, layout SketchUp, 3D Visualizations, rendering, drafting, and mood boards Collaborate with clients to understand their needs, preferences, and lifestyle Work on-site with contractors and suppliers to ensure execution aligns with the design vision Stay up-to-date with trends, materials, and industry developments Manage project timelines and budgets effectively Submit your CV and portfolio if you have one. If you or someone you know fits this role, we’d love to hear from you! Let’s shape extraordinary spaces—and bold brand stories—together.",Thu Mar 26 2026 03:00:35 GMT+0700 (Western Indonesia Time)
